,year,month,year_month,account_name,monthly_articles,monthly_posts,monthly_read_10000_more,monthly_articles_origin,monthly_first_have_chaolianjie,monthly_first_have_newmedia,monthly_first_have_tupian1yinpin1shipin,monthly_likes_sum,monthly_old_likes_sum,monthly_likes_mean,monthly_old_likes_mean,monthly_likes_mean_first_post,monthly_old_likes_mean_first_post,monthly_likes_max,monthly_read_sum,monthly_read_mean,monthly_read_first_post,monthly_read_max,monthly_content_num,monthly_auther_reply_num,monthly_content_like_num,monthly_auther_like_num,monthly_titles
64,2022,5,2022-5,读书杂志,28.0,16.0,4.0,14.0,0.0,1.0,1.0,673.0,919.0,24.035714285714285,32.82142857142857,38.375,51.875,100.0,130980.0,4677.857142857143,38.375,11526.0,14.0,0.0,14.0,0.0,《读书》视频 | 卜键：乾隆皇帝是“恋物”还是“重情”？☀中读课 | 这些经典影片，有多少人假装看懂，又有多少人假装看过？☀《读书》首发 | 许准：粮仓或是粮荒☀中读年卡 | 足不出户的日子里，别再说你没空读书☀《读书》首发 | 仲伟民：何兆武先生的中外融通☀旧锦新样 | 刘晓峰：一所悬命☀中读课 ｜ 她是中国最好的电影学者，北大学生排队两小时听她的课☀《读书》新刊 | 邢承吉：纽约晨边高地的今昔☀中读课 ｜ 叶嘉莹：我想在离开前，把即将失传的吟诵留下☀《读书》新刊 | 林少华：审美忠实与“捧金鱼”☀中读年卡 ｜ 「知识会员」重磅升级，限时5折，错过等一年☀旧锦新样 | 赵国新：英国左派读书俱乐部的兴衰☀中读年卡 | 伍尔夫：女性的独立，不只是“自己的一间房”☀《读书》新刊 | 李庆西：木犹如此，人何以堪☀中读年卡 | 人性和人心，他400多年前就说透了☀《读书》新刊 | 徐前进：构建日常生活的叙事☀旧锦新样 | 海青：岂独伤心是小青？☀中读课 | 又仙又有烟火气，古人写的好文章，如果错过就太可惜了☀《读书》新刊 | 卜键：清臣的贡品☀中读年卡 | 中国人为何嗜茶？☀《读书》新刊 | 段志强：看脸时代☀中读年卡 | 5周年限定！送三联书店500元好书盲盒！☀《读书》新刊 | 韩毓海：杨家沟☀中读年卡 | 三联×读库×财新：给你来点儿不一样的☀《读书》首发 | 李零：北京中轴线☀中读课 | 每天不想上班，只想躺平，怎么办？☀《读书》首发 | 王铭铭：新中国人类学的“林氏建议”☀新刊速递：2022年第5期封面+目录
65,2022,6,2022-6,读书杂志,30.0,17.0,2.0,17.0,0.0,1.0,1.0,813.0,1140.0,27.1,38.0,44.11764705882353,61.588235294117645,226.0,145161.0,4838.7,44.11764705882353,23475.0,27.0,0.0,233.0,0.0,《读书》视频 | 许准：民以食为天：粮食与政治☀赵汀阳：“满天星斗”模型与文明之间的“恰当距离” | 苏秉琦先生逝世25周年纪念☀中读课 | 连鲁迅都痴迷的《山海经》，到底藏了多少秘密？☀荐书 | 我的父亲苏秉琦：一个考古学家和他的时代☀新刊速递：2022年第7期封面+目录☀中读课 | 她是中国最好的电影学者，北大学生排队两小时听她的课☀《读书》首发| 渠敬东：燃烧的学问和火一样的人☀中读课 | 来了！让20000人爱上古典音乐的他，再出新课！☀《读书》新刊 | 戴潍娜：黑弥撒与撒旦先生☀中读年卡 | 奇幻，绝美，高能，《山海经》里的精怪火出圈了☀《读书》新刊 | 王路：“形而上学”与“元宇宙”☀直播预告 | 田浩江 汪晖 西川 郭文景：我们的中西音乐记忆☀《读书》新刊 | 焦姣：美国社会科学史中的时间静止术☀《读书》新刊 | 李旻：于断裂处重生☀中读课 | 听说掌握了这100个经济学原理，你的人生会像开挂了一样☀夏日书单 | 2022年上半年书单☀中读课 | 资深古典乐迷养成计划，你敢来挑战吗？☀《读书》新刊 | 潘振平：回忆陈旭麓老师☀《读书》新刊 | 戴海斌：辛亥年的周善培☀中读年卡：纪念卡夫卡——我们今天的生活，早已被他预言☀《读书》新刊 | 康子兴：从文明帝国到帝国文明☀中读课 | 《梦华录》之外，真实的宋朝是什么样的？☀《读书》新刊 | 卢周来：“故事”如何影响经济决策与宏观☀《读书》新刊 | 王升远：“非常时期”的一场越境私奔☀荐书 ｜《自说自画：李保田》☀《读书》视频 | 卜键：文与史之间需要贯通☀新刊速递：2022年第6期封面+目录☀《读书》新刊 | 王宁：两代人的志向与情怀☀《读书》首发 | 许纪霖：“大正之子”丸山真男的思想史研究☀中读课 | 钱锺书、胡适等牛人为什么都喜欢写读书笔记？
66,2022,7,2022-7,读书杂志,27.0,14.0,0.0,12.0,0.0,1.0,1.0,433.0,624.0,16.037037037037038,23.11111111111111,28.857142857142858,40.642857142857146,51.0,94416.0,3496.8888888888887,28.857142857142858,7575.0,8.0,2.0,27.0,0.0,《读书》首发 | 高士华：石原慎太郎的底色☀中读课 | 约翰逊辞职、安倍遇刺，如何看清政治事件背后的风云变幻？☀实习生招募 | 欢迎到《读书》看一看☀实习生招募 | 欢迎到《读书》看一看☀中读课 | 书是别人的，读书笔记才是你自己的☀《读书》新刊 | 谢惠媛：我们的恐惧关乎什么？☀中读课 | 这个暑假，智慧父母都这样帮孩子学历史☀旧锦新样 | 陈燕谷：重构全球主义的世界图景☀中读年卡 | 中国人的底层逻辑，就写在这部千年史书里☀《读书》新刊 | 汪家明：设计有道☀中读年卡 | 豆瓣高分9.0！书界“颜值天花板”，看过的人都说终身难忘☀《读书》新刊 | 蔡天新：弗雷格、逻辑和真理☀中读年卡 | 豆瓣9.6！一次看懂83位艺术大师和1000年艺术史！☀旧锦新样 |朱玲：阅读杜老☀中读年卡 | 诗经、唐诗、宋词：翻译泰斗许渊冲，带你读懂古诗词的绝美☀《读书》新刊| 黄博：古格的黄昏☀中读课 | 我们为何如此关注邻国动态？☀《读书》新刊 | 孟晖：千年前的玻璃油灯☀中读课 | 下半年，我无法解决焦虑，只想过得幸福一点☀旧锦新样 | 聂绀弩：小红论☀中读课 | 了不起的敦煌：哈佛、北大等13位大咖学者带你800分钟看懂它☀《读书》新刊 | 蒋寅：久被忘忽的钱锺书诗集☀中读课 | 为何要做读书笔记？文学大家都是这样练成的☀《读书》视频 | 许准：靠世界市场吃饱饭不现实☀中读课 | 我们对于未来的不安，20世纪早有答案☀《读书》新刊 | 罗新：亮亮柴与狐狸火☀《读书》首发 | 范雪：书店主体性：知识、干部与制度
67,2022,8,2022-8,读书杂志,35.0,17.0,2.0,17.0,0.0,1.0,1.0,732.0,984.0,20.914285714285715,28.114285714285714,41.588235294117645,54.529411764705884,178.0,137593.0,3931.2285714285713,41.588235294117645,21515.0,4.0,0.0,52.0,0.0,《读书》新刊 | 延雨：信札里的俞曲园先生☀中读年卡 | 什么书能随清华大学录取通知书一起寄给学生？☀《读书》新刊 | 江晓原、穆蕴秋：科学“神刊”是怎样办☀中读年卡 | 美了1600年的敦煌壁画，在这套书里活过来了！☀旧锦新样 | 吕微：何其芳的传说☀中读年卡 | 三联×财新通：买一得二，5折！再降100元！（史无前例）☀《读书》视频 | 罗新：一位学者的学术自传☀中读课 | 为什么思想史在中国这么火？思想史著作能卖到几万本？☀活动&直播预告｜三联学术论坛03-06期☀《读书》新刊 | 陈越：阿尔都塞和孤独☀中读课 | 说实在的，没有人能绕过传播学☀《读书》新刊 | 余明锋：绩效社会的暴力和自由☀中读年卡 | 每个成年人心里，都有一个喜欢神话的孩子☀《读书》新刊 | 张宝明：灵魂膨胀的解药何处寻？☀中读年卡 | 这600首璀璨唐诗，被错过了500年☀三店史话 | 冯淼：《读书生活》与城市劳工的知识革命☀中读课 ｜三联写作课又上新！家长们可以躺赢了☀遗稿 | 田余庆：一位学者的学术自传☀中读课 | 世界经济到底怎么了？为什么你看到的问题只是“问题”？☀旧锦新样 | 黄裳：忆吴晗☀中读年卡 | 真的，没有猫咪的人生无法想象☀《读书》新刊 | 李思磐：美国新闻业的“古腾堡时刻”☀中读课 | 你假期去博物馆了吗？☀《读书》新刊 | 郑岩：碎金屑玉的意义☀中读课 | 复旦教授：别再做只能“感动自己”的读书笔记了☀《读书》视频 | 谢惠媛：我们的恐惧关乎什么☀中读年卡 | 华丽、繁复、惊艳，他的画笔影响了世界审美100年☀旧锦新样 | 施爱东：“织女”的故事☀中读年卡 ｜ 古典音乐，保养灵魂的仪式☀《读书》新刊 | 李雪涛：近代早期的伊比利亚全球化☀中读课 ｜ 戴锦华，只有看完她的影评，你才能说是看懂了电影☀新刊速递：2022年第8期封面+目录☀中读课 | “上完乐理课，我的眼里没有光了”☀《读书》首发 | 徐天：“中国人必须走”☀中读年卡 | 三联×财新：买一得二，限时5折！前5000位加送智能音箱
68,2022,9,2022-9,读书杂志,32.0,17.0,3.0,15.0,0.0,1.0,1.0,605.0,794.0,18.90625,24.8125,34.05882352941177,42.23529411764706,104.0,125900.0,3934.375,34.05882352941177,16964.0,6.0,0.0,6.0,0.0,《读书》首发 | 金冲及：退而不休的治史体悟☀《读书》征订信息，欢迎一键订阅☀《读书》首发 | 葛兆光：以亚洲作为历史视野☀中读年卡 | 可以“镇宅”的全球史，一部看透500万年！☀活动 |《读书》向您征集读后感啦！☀中读课 ｜ 央美教授黄小峰：精讲中国艺术史☀《读书》新刊 | 马姝：“桑格热”之后☀中读课 | 内容创作的“36条爆款法则”，这7个头部大号想和你分享☀旧锦新样 | 罗岗：“文学”与“大东亚战争”☀中读年卡 | 做人若像丰子恺，生活哪里都可爱！☀《读书》新刊 | 陈忠平：黄远庸暗杀案档案揭秘☀中读课 | 《史记》里的这些话，听懂两句就够你用一生了☀《读书》新刊 | 林雅华：“黎明前的一缕微光”☀中读课 | 读书不一定能让你成为更好的自己，但读书笔记可以☀旧锦新样 | 陈乐民：论卢梭☀中读课 | 谁在争夺你的注意力？让传播学解答你的困惑☀《读书》新刊 | 陈晓琳：爱情的另一面☀中读课 | 克服无聊的方式，除了恋爱，还有什么？☀三店史话 | 范世涛：直面中国问题：一个左翼书店风格的由来☀中读课 | 恭喜你获得内测资格！三联独家「外刊」训练营，40天5步打通底层逻辑☀《读书》新刊 | 王英：法兰西的女性世界☀旧锦新样 | 李锐：毛泽东早年的两首诗☀中读年卡｜读200份好杂志，每天只需8毛钱☀《读书》新刊 | 于京东：鹅棋：命运游戏与意外之旅☀中读年卡 | 史书读不进去？这套700万字的神仙史书，有人一个月读完了☀新刊速递：2022年第9期封面+目录☀中读课 | 七位中国媒体圈老炮告诉你：怎样写出好的评论文章？☀《读书》新刊 | 姜宇辉：游戏何以政治？☀《读书》首发 | 陈恒：不灭的亚历山大大帝☀中读年卡 | 三联×财新通：买一得二，5折！再降100元！（史无前例）☀《读书》首发 | 王小章：历史能不能假设？☀中读课 ｜ 带孩子看山海经动画，你必须了解的几件事
